{
  "format": "hyper-mixer",
  "format_version": 1,
  "id": "018f47a2-6b2d-7c11-8a44-001122334468",
  "project_id": "018f47a2-6b2d-7c11-8a44-001122334455",
  "channels": [
    {
      "track_id": "018f47a2-6b2d-7c11-8a44-001122334456",
      "gain_millionths": 1000000,
      "pan_millionths": 0,
      "mute": false,
      "solo": false,
      "destination": {
        "kind": "main"
      },
      "sends": []
    }
  ],
  "return_buses": [],
  "main": {
    "gain_millionths": 1000000,
    "mute": false
  },
  "cue": {
    "source": "solo",
    "gain_millionths": 1000000,
    "mute": false
  },
  "extensions": {}
}
